{"h":256,"id":"g3q.0","png":"iVBORw0KGgoAAAANSUhEUgAAAQAAAAEACAYAAABccqhmAAAGuElEQVR42u3ZMYjcRRjG4RW7oGUsT+wWuyA2YdEiGK0kYhFYtDJqI6eNsGLloY2cWgindqdlxO6w1Nba2tbW1nLMEIZMJt/3WXrg88DUKZb3l//NbHan+7a/m58rx9u2Pc3PY8fX2tOn+dkcX29PneZnc3yjPXman6PdH223z8/V3Z/tuX1+ntj91Z7d5+fx3d/tmX1+DrdutbPj/Nzabtvxzfy8vL3W3r6Znxe219sbN/Pz/PZGe/1mfq5sr7SjO9v0bO79G1fv5Gdz79944k5+Nvf+jcfv5Gd/sm+H8/y8dvJWe/88P6+cvNfeOc/PiycftjfP83P37NB+u8jP92eftF8v8vPt2eft54v8fHX2dfvpIj8X52ft91/ys9+ftMMhP2dHu3axy88XRy+1H3f5+fTo1fbDLj8fH91u3+3ys+kjryLQR15FoI+8isD9kecB6COvItBHXkWgj7yKQB95FYE+8ioCfeRVBPrIqwj0kVcR6COvItBHXkXg/sjzANwfeR6A+yPPA9BHXkWgj7yKQB95FYE+8ioCfeRVBPrIqwj0kVcR6COvItBHXkWgj7yKQB95FYE+8ioCfeRVBPrIqwj0kVcR2IyhZxEYQ88iMIaeReDB//R5AKoIjKFnERhDzyIwhp5FYAw9i8AYehaBMfQsAmPoWQTG0LMIjKFnEXjwP30egCoCD/6nzwNQRWAMPYvAGHoWgTH0LAJj6FkExtCzCIyhZxEYQ88iMIaeRWAMPYvAGHoWgTH0LAJj6FkExtCzCIyhZxHYzGOPIjCPPYrAPPYoAg9/7ucByCIwjz2KwDz2KALz2KMIzGOPIjCPPYrAPPYoAvPYowjMY48iMI89isDDn/t5ALIIPPy5nwcgi8A89igC89ijCMxjjyIwjz2KwDz2KALz2KMIzGOPIjCPPYrAPPYoAvPYowjMY48iMI89isA89igC89ijCGzWwa8RWAe/RmAd/BqBR//mzwMQRWAd/BqBdfBrBNbBrxFYB79GYB38GoF18GsE1sGvEVgHv0ZgHfwagUf/5s8DEEXg0b/58wBEEVgHv0ZgHfwagXXwawTWwa8RWAe/RmAd/BqBdfBrBNbBrxFYB79GYB38GoF18GsE1sGvEVgHv0ZgHfwagU302T9HIPrsnyMQffbPEYgv/vIArBGIPvvnCESf/XMEos/+OQLRZ/8cgeizf45A9Nk/RyD67J8jEH32zxGIPvvnCMQXf3kA1gjEF395ANYIRJ/9cwSiz/45AtFn/xyB6LN/jkD02T9HIPrsnyMQffbPEYg+++cIRJ/9cwSiz/45AtFn/xyB6LN/jkD02T9HIPrsnyOwyS7/RgSyy78Rgezyb0Qgv/3PAzBHILv8GxHILv9GBLLLvxGB7PJvRCC7/BsRyC7/RgSyy78Rgezyb0Qgu/wbEchv//MAzBHIb//zAMwRyC7/RgSyy78Rgezyb0Qgu/wbEcgu/0YEssu/EYHs8m9EILv8GxHILv9GBLLLvxGB7PJvRCC7/BsRyC7/RgSyy78RgU31BNgjUD0B9ghUT4A9AvUT4PXyCbBHoHoC7BGongB7BKonwB6B6gmwR6B6AuwRqJ4AewSqJ8AegeoJsEegegLsEaifALf/8gR47V+eAK+XT4A9AtUTYI9A9QTYI1A9AfYIVE+APQLVE2CPQPUE2CNQPQH2CFRPgD0C1RNgj0D1BNgjUD0B9ghUT4A9AtUTYI9A9QTYI7A52e/a+SE/H+1fat8c8vPB/tX25SE/7+5vt88O+dkA/50+8ioCfeRVBPrIqwj0kVcR8AvAfxyAKgJj6FkExtCzCIyhZxHwC8AlCEAWgXnsUQTmsUcRmMceRcAvAJckAFEE1sGvEVgHv0ZgHfwaAb8AXKIArBGIPvvnCESf/XMEos/+OQJ+AbhkAZgjkF3+jQhkl38jAtnl34iAXwAuYQBGBKonwB6B6gmwR6B6AuwR8AsAAAAAAAAAAAAAAAAAAAAAAAAAAAAAAAAAAAAAAAAAAAAAAAAAAAAAAAAAAAAAAAAAAAAAAAAAAAAAAAAAAAAAAAAAAAAAAAAAAAAAAAAAAAAAAAAAAAAAAAAAAAAAAAAAAAAAAAAAAAAAAAAAAAAAAAAAAAAAAAAAAAAAAAAAAAAAAAAAAAAAAAAAAAAAAAAAAAAAAAAAAAAAAAAAAAAAAAAAAAAAAAAAAAAAAAAAAAAAAAAAAAAAAAAAAAAAAAAAAAAAAAAAAAAAAAAAAAAAAAAAAAAAAAAAAAAAAAAAAAAAAAAAAAAAAAAAAAAAAP9X/wDkJQNzApx1FwAAAABJRU5ErkJggg==","w":256}