{"h":48,"id":"tilesets.test","png":"iVBORw0KGgoAAAANSUhEUgAAAIAAAAAwCAAAAAD8ny1iAAABR0lEQVR42u2UW67DMAhEZ5Ns0ptMkxhsHiF2VV3dH1DrSK0Jh2FsHBzU2v0hItC1SIwfeGnt3nk8xPUXXDQXNJYemMmMwFXvev0BzSPpKQDnjWcEIQM6krl+BMB8nIu0sAugCncKJwH8CET4AQClwwXA6WfKpN9SYOpAjwokI/AekBY8gIwlV0AArAQbI+DvwoQZgPLANBA9KBBOQeYBZ0JtsncFrAnzU0AWPXjAmTAAJOHPYVBAanhcmbW/F4b2MH3MAKnAkQX4zYe0aTxzgqcAwq8ATFO7ADxeBAXQ21N1jStH4QnAu5gAigAvANBGMwp0AFEgA5hdK0h8ASD1MwVWAOM+CAUd0GoEmQLLEaQAbiSrEUQFrAnXANF0/qS9jmBceO7c/gKwE/s7/ygKoAAKoAAKoAAKoAAKoAAKoAAKoAAK4N8BPtU+D7WXpiFnAAAAAElFTkSuQmCC","w":128}